{
    "align": [
        {
            "name": "align-eureka-client",
            "group": "com.netflix.eureka",
            "includes": ["eureka-(client|client-archaius2|client-jersey2|test-utils)"],
            "reason": "Align Eureka Client libraries.",
            "author": "David Liu <dliu@netflix.com>",
            "date": "2016-10-11"
        }
    ],
    "replace": [],
    "substitute": [],
    "deny": [],
    "exclude": [],
    "reject": []
}
